{
  "$schema": "https://json-schema.org/draft/2020-12/schema",
  "$id": "heyhi:ds-component-author:component-spec:1.0",
  "title": "DS Component Spec",
  "description": "The single component spec that drives BOTH legs of ds-component-author (the Figma component and the code twin). The anatomy and property axes are a human design decision (required input, never invented by the skill); the craft critique and the framework-idiom calls ship empty behind the named gates. classification: HeyHi Confidential.",
  "type": "object",
  "additionalProperties": false,
  "required": ["schema_version", "name", "level", "anatomy", "property_axes", "states", "tokens", "framework", "gate"],
  "properties": {
    "schema_version": { "const": "1.0" },
    "name": {
      "type": "string",
      "pattern": "^[A-Z][A-Za-z0-9]*$",
      "description": "PascalCase component name; becomes the Figma component-set name and the code component name."
    },
    "level": {
      "enum": ["token", "atom", "molecule", "organism", "template"],
      "description": "Atomic level, aligned with ds-map.json (figma-library-census). A human design decision."
    },
    "anatomy": {
      "type": "array",
      "minItems": 1,
      "description": "The named regions of the component (a design decision, the human authors this; the skill never invents anatomy).",
      "items": {
        "type": "object",
        "additionalProperties": false,
        "required": ["region", "role"],
        "properties": {
          "region": { "type": "string", "minLength": 1 },
          "role": { "type": "string", "minLength": 1 },
          "optional": { "type": "boolean", "default": false }
        }
      }
    },
    "property_axes": {
      "type": "array",
      "minItems": 1,
      "description": "The property model shared by both legs. VARIANT axes require a non-empty values array (a VARIANT with no values is rejected). A design decision.",
      "items": {
        "type": "object",
        "additionalProperties": false,
        "required": ["name", "type"],
        "properties": {
          "name": { "type": "string", "minLength": 1 },
          "type": { "enum": ["VARIANT", "TEXT", "BOOLEAN", "INSTANCE_SWAP", "SLOT"] },
          "values": {
            "type": "array",
            "items": { "type": "string", "minLength": 1 },
            "description": "The enum options for a VARIANT axis. Required and non-empty when type is VARIANT."
          },
          "default": { "description": "Default value (string for VARIANT/TEXT, boolean for BOOLEAN, component ref for INSTANCE_SWAP)." },
          "optional": { "type": "boolean", "default": false },
          "maps_to_prop": { "type": "string", "description": "The code prop name this axis binds to (defaults to a camelCase of name)." }
        },
        "allOf": [
          {
            "if": { "properties": { "type": { "const": "VARIANT" } } },
            "then": { "required": ["values"], "properties": { "values": { "minItems": 1 } } }
          }
        ]
      }
    },
    "states": {
      "type": "array",
      "description": "Interaction states, taken from an interaction-inventory sidecar (heyhi:interaction-inventory:sidecar:1.0). State names use that schema's enum; a11y_hook carries the accessible name/role note per state.",
      "items": {
        "type": "object",
        "additionalProperties": false,
        "required": ["name", "applies_to"],
        "properties": {
          "name": { "enum": ["default", "hover", "focus-visible", "active", "disabled", "loading", "error", "success", "selected", "empty", "populated"] },
          "applies_to": { "type": "string", "minLength": 1, "description": "Which anatomy region the state applies to." },
          "a11y_hook": { "type": ["string", "null"], "default": null },
          "keyboard": { "type": ["string", "null"], "default": null }
        }
      }
    },
    "slots": {
      "type": "array",
      "default": [],
      "description": "Optional SLOT content regions (createSlot in Figma → children/getSlot in code). Empty when the component uses TEXT/INSTANCE_SWAP rather than a slot.",
      "items": {
        "type": "object",
        "additionalProperties": false,
        "required": ["name"],
        "properties": {
          "name": { "type": "string", "minLength": 1 },
          "maps_to_prop": { "type": "string" }
        }
      }
    },
    "tokens": {
      "type": "object",
      "minProperties": 1,
      "description": "Role -> served-token-name map (semantic role tokens, not primitives, not literals). Retrieved through the design-system instance; the skill never reads a token file from disk.",
      "additionalProperties": {
        "oneOf": [
          { "type": "string", "minLength": 1 },
          { "type": "object", "additionalProperties": { "type": "string", "minLength": 1 } }
        ]
      }
    },
    "framework": {
      "enum": ["react", "lit", "angular"],
      "description": "The code-leg target. v1 builds react; lit and angular are named stubs (D5)."
    },
    "code_connect": {
      "type": "object",
      "additionalProperties": false,
      "properties": {
        "emit": { "type": "boolean", "default": true, "description": "Emit the parserless .figma.ts template regardless of plan." },
        "publish": { "type": "boolean", "default": false, "description": "Call add_code_connect_map. Requires an Organization/Enterprise plan AND an explicit plan allowance; false by default." }
      }
    },
    "gate": {
      "type": "object",
      "additionalProperties": false,
      "required": ["spec_review", "component_review"],
      "description": "The two named human gates. Both ship with null owner/date by construction; a human signs them. The skill never fills these.",
      "properties": {
        "spec_review": {
          "type": "object",
          "additionalProperties": false,
          "required": ["owner", "date"],
          "properties": { "owner": { "type": ["string", "null"] }, "date": { "type": ["string", "null"] } }
        },
        "component_review": {
          "type": "object",
          "additionalProperties": false,
          "required": ["owner", "date"],
          "properties": { "owner": { "type": ["string", "null"] }, "date": { "type": ["string", "null"] } }
        }
      }
    }
  }
}
